{
  "$schema": "../../core_schemas/architecture_sat_gate_map.json",
  "pack_id": "remote_resilient_microgrid",
  "spec_version": "1.0.0",
  "gate_namespace": "remote_resilient_microgrid",
  "gates": [
    {
      "gate_id": "remote_resilient_microgrid.diesel_baseline",
      "safety_gate": "Generator protective relays, overspeed paths, and load-bank baseline demonstrated.",
      "sat_protocol_step": 1,
      "required_result": "pass",
      "evidence_catalogs": ["remote_resilient_microgrid-local"],
      "evidence_types": ["DieselLoadBankBaselineRecorded", "GovernorFrequencyResponseInBand", "ProtectiveRelayTripVerified"],
      "ledger_transition": "ReadyForCommission -> Commissioned",
      "example_required": true,
      "notes": "Analog load-bank sheets, governor observations, and relay trip witnesses become these digital evidence_refs before the gate can pass."
    },
    {
      "gate_id": "remote_resilient_microgrid.cots_inverter_join",
      "safety_gate": "COTS inverter anti-island and transfer sequence verified.",
      "sat_protocol_step": 2,
      "required_result": "pass",
      "evidence_catalogs": ["solar-inverter-commissioning", "remote_resilient_microgrid-local"],
      "evidence_types": ["AntiIslandingOk", "GridVoltageInBand", "FrequencyInBand", "TransferSwitchPositionVerified"],
      "ledger_transition": "ReadyForCommission -> Commissioned",
      "example_required": true,
      "notes": "Anti-islanding is the primary machine assertion; witnessed transfer switch position is digitized as pack-local Evidence."
    },
    {
      "gate_id": "remote_resilient_microgrid.hybrid_handoff",
      "safety_gate": "Diesel and storage handoff completed with evidence-gated transitions.",
      "sat_protocol_step": 3,
      "required_result": "pass",
      "evidence_catalogs": ["bess-commissioning", "solar-inverter-commissioning", "remote_resilient_microgrid-local"],
      "evidence_types": ["HybridHandoffSequenceOk", "CellVoltageInBand", "GridVoltageInBand"],
      "ledger_transition": "ReadyForCommission -> Commissioned",
      "example_required": true,
      "notes": "Records the analog-to-digital handoff point: observed diesel/storage transfer becomes a ledger-linked sequence Evidence item."
    },
    {
      "gate_id": "remote_resilient_microgrid.ddil_drill",
      "safety_gate": "Offline ledger integrity checked after disconnect and reconnect.",
      "sat_protocol_step": 4,
      "required_result": "pass",
      "evidence_catalogs": ["remote_resilient_microgrid-local"],
      "evidence_types": ["LocalLedgerAppendProof", "ReconnectSyncProof"],
      "ledger_transition": "ReadyForCommission -> Commissioned",
      "example_required": true,
      "notes": "Observed uplink disconnect/reconnect is accepted only when local append and reconnect sync proofs are linked in the ledger."
    },
    {
      "gate_id": "remote_resilient_microgrid.owner_handoff_export",
      "safety_gate": "Mission-owner handoff export generated from ledger and SAT log artifacts.",
      "sat_protocol_step": 5,
      "required_result": "pass",
      "evidence_catalogs": ["remote_resilient_microgrid-local"],
      "evidence_types": ["OwnerHandoffManifestGenerated"],
      "ledger_transition": "ReadyForCommission -> Commissioned",
      "example_required": true,
      "notes": "Handoff is a structured export manifest generated from the ledger and SAT log, not a screenshot dump."
    }
  ]
}
